{
  "schema_version": 1,
  "protocol_id": "hacc-proof-v1",
  "example_only": true,
  "run_id": "example-openai-pair-001-hacc",
  "pair_id": "example-openai-pair-001",
  "schedule_ordinal": 1,
  "provider": "openai",
  "arm": "full_hacc",
  "network_admission": "admitted",
  "terminal_disposition": "completed",
  "raw_manifest_finalized_before_evaluation": true,
  "artifacts": {
    "source_identity": { "path": "raw/source-identity.json", "sha256": "0000000000000000000000000000000000000000000000000000000000000001", "byte_length": 1, "content_addressed": true, "reopened_and_verified": true },
    "freeze_lock": { "path": "raw/freeze-lock.json", "sha256": "0000000000000000000000000000000000000000000000000000000000000002", "byte_length": 1, "content_addressed": true, "reopened_and_verified": true },
    "scenario": { "path": "raw/scenario.json", "sha256": "0000000000000000000000000000000000000000000000000000000000000003", "byte_length": 1, "content_addressed": true, "reopened_and_verified": true },
    "treatment": { "path": "raw/treatment.json", "sha256": "0000000000000000000000000000000000000000000000000000000000000004", "byte_length": 1, "content_addressed": true, "reopened_and_verified": true },
    "parity": { "path": "raw/parity.json", "sha256": "0000000000000000000000000000000000000000000000000000000000000005", "byte_length": 1, "content_addressed": true, "reopened_and_verified": true },
    "input_audio_index": { "path": "raw/input-audio/index.json", "sha256": "0000000000000000000000000000000000000000000000000000000000000006", "byte_length": 1, "content_addressed": true, "reopened_and_verified": true },
    "provider_wire": { "path": "raw/provider-events.jsonl", "sha256": "0000000000000000000000000000000000000000000000000000000000000007", "byte_length": 1, "content_addressed": true, "reopened_and_verified": true },
    "session_identity": { "path": "raw/session-identity.json", "sha256": "0000000000000000000000000000000000000000000000000000000000000008", "byte_length": 1, "content_addressed": true, "reopened_and_verified": true },
    "normalized_events": { "path": "raw/normalized-events.jsonl", "sha256": "0000000000000000000000000000000000000000000000000000000000000009", "byte_length": 1, "content_addressed": true, "reopened_and_verified": true },
    "caller_selections": { "path": "raw/caller-selections.jsonl", "sha256": "000000000000000000000000000000000000000000000000000000000000000a", "byte_length": 1, "content_addressed": true, "reopened_and_verified": true },
    "caller_fact_ledger": { "path": "raw/caller-fact-ledger.jsonl", "sha256": "000000000000000000000000000000000000000000000000000000000000000b", "byte_length": 1, "content_addressed": true, "reopened_and_verified": true },
    "output_audio_index": { "path": "raw/output-audio/index.json", "sha256": "000000000000000000000000000000000000000000000000000000000000000c", "byte_length": 1, "content_addressed": true, "reopened_and_verified": true },
    "playback_ranges": { "path": "raw/output-audio/playback-ranges.jsonl", "sha256": "000000000000000000000000000000000000000000000000000000000000000d", "byte_length": 1, "content_addressed": true, "reopened_and_verified": true },
    "actions": { "path": "raw/actions.jsonl", "sha256": "000000000000000000000000000000000000000000000000000000000000000e", "byte_length": 1, "content_addressed": true, "reopened_and_verified": true },
    "world_initial": { "path": "raw/world-initial.json", "sha256": "000000000000000000000000000000000000000000000000000000000000000f", "byte_length": 1, "content_addressed": true, "reopened_and_verified": true },
    "world_events": { "path": "raw/world-events.jsonl", "sha256": "0000000000000000000000000000000000000000000000000000000000000010", "byte_length": 1, "content_addressed": true, "reopened_and_verified": true },
    "world_final": { "path": "raw/world-final.json", "sha256": "0000000000000000000000000000000000000000000000000000000000000011", "byte_length": 1, "content_addressed": true, "reopened_and_verified": true },
    "kernel_transcript": { "path": "raw/kernel-transcript.jsonl", "sha256": "0000000000000000000000000000000000000000000000000000000000000012", "byte_length": 1, "content_addressed": true, "reopened_and_verified": true },
    "kernel_attestation": { "path": "raw/kernel-attestation.json", "sha256": "0000000000000000000000000000000000000000000000000000000000000013", "byte_length": 1, "content_addressed": true, "reopened_and_verified": true },
    "usage_pricing": { "path": "raw/usage-pricing.json", "sha256": "0000000000000000000000000000000000000000000000000000000000000014", "byte_length": 1, "content_addressed": true, "reopened_and_verified": true },
    "terminal_journal": { "path": "raw/terminal-journal.json", "sha256": "0000000000000000000000000000000000000000000000000000000000000015", "byte_length": 1, "content_addressed": true, "reopened_and_verified": true },
    "budget_settlement": { "path": "raw/budget-settlement.json", "sha256": "0000000000000000000000000000000000000000000000000000000000000016", "byte_length": 1, "content_addressed": true, "reopened_and_verified": true },
    "blind_package": { "path": "evaluation/blind-package.json", "sha256": "0000000000000000000000000000000000000000000000000000000000000017", "byte_length": 1, "content_addressed": true, "reopened_and_verified": true },
    "sealed_blind_map": { "path": "evaluation/sealed-blind-map.json", "sha256": "0000000000000000000000000000000000000000000000000000000000000018", "byte_length": 1, "content_addressed": true, "reopened_and_verified": true },
    "evaluation_contract": { "path": "evaluation/evaluation-contract.json", "sha256": "0000000000000000000000000000000000000000000000000000000000000019", "byte_length": 1, "content_addressed": true, "reopened_and_verified": true },
    "normative_shadow": { "path": "evaluation/normative-shadow.jsonl", "sha256": "000000000000000000000000000000000000000000000000000000000000001a", "byte_length": 1, "content_addressed": true, "reopened_and_verified": true },
    "audio_alignment": { "path": "evaluation/audio-alignment.jsonl", "sha256": "000000000000000000000000000000000000000000000000000000000000001b", "byte_length": 1, "content_addressed": true, "reopened_and_verified": true },
    "score_v2": { "path": "evaluation/score-v2.json", "sha256": "000000000000000000000000000000000000000000000000000000000000001c", "byte_length": 1, "content_addressed": true, "reopened_and_verified": true },
    "independent_replay": { "path": "evaluation/independent-replay.json", "sha256": "000000000000000000000000000000000000000000000000000000000000001d", "byte_length": 1, "content_addressed": true, "reopened_and_verified": true },
    "trust_pins": { "path": "evaluation/trust-pins.json", "sha256": "000000000000000000000000000000000000000000000000000000000000001e", "byte_length": 1, "content_addressed": true, "reopened_and_verified": true }
  },
  "required_artifact_kinds": [
    "source_identity", "freeze_lock", "scenario", "treatment", "parity", "input_audio_index", "provider_wire", "session_identity", "normalized_events", "caller_selections", "caller_fact_ledger", "output_audio_index", "playback_ranges", "actions", "world_initial", "world_events", "world_final", "kernel_transcript", "kernel_attestation", "usage_pricing", "terminal_journal", "budget_settlement", "blind_package", "sealed_blind_map", "evaluation_contract", "normative_shadow", "audio_alignment", "score_v2", "independent_replay", "trust_pins"
  ],
  "manifest_root_sha256": "ffffffffffffffffffffffffffffffffffffffffffffffffffffffffffffffff"
}
